{
  "$schema": "http://json-schema.org/draft-07/schema#",
  "title": "Synthetic Test Definition",
  "type": "object",
  "required": ["url", "steps"],
  "properties": {
    "url": {
      "type": "string",
      "format": "uri"
    },

    "inputs": {
      "type": "array",
      "items": {
        "type": "object",
        "required": ["selector", "value"],
        "properties": {
          "selector": { "type": "string" },
          "value":    { "type": "string" }
        },
        "additionalProperties": false
      }
    },

    "steps": {
      "type": "array",
      "minItems": 1,
      "items": {
        "type": "object",
        "required": ["action", "selector"],
        "properties": {
          "action":   { "type": "string" },
          "selector": { "type": "string" },
          "value":    { "type": "string" }
        },
        "additionalProperties": false
      }
    },

    "expectedElements": {
      "type": "array",
      "items": {
        "type": "object",
        "required": ["selector"],
        "properties": {
          "selector": { "type": "string" },
          "text":     { "type": "string" }
        },
        "additionalProperties": false
      }
    }
  },

  "additionalProperties": false
}
